{
  "condition": "one explicitly authorized remote repository, provider, deployment, or configuration action is requested",
  "dependency_records": [
    {
      "evidence": [
        "curation/v2/fusion/decisions.jsonl",
        "sentry-setup-releases/SKILL.md:26-64",
        "sentry-setup-ai-monitoring/SKILL.md:119-150"
      ],
      "id": "V2-DEPENDENCY-0180",
      "kind": "optional",
      "legacy_source_cluster_id": null,
      "legacy_target_cluster_id": null,
      "rationale": "AI telemetry extends a configured release-observability boundary when the product contains model calls.",
      "source_capability_id": "capability:release-observability-configuration",
      "target_capability_id": "capability:ai-observability-configuration"
    },
    {
      "evidence": [
        "curation/v2/fusion/decisions.jsonl",
        "dd-apm/k8s-ssi/agent-install/SKILL.md:102-126",
        "dd-apm/SKILL.md:129-135"
      ],
      "id": "V2-DEPENDENCY-0182",
      "kind": "optional",
      "legacy_source_cluster_id": null,
      "legacy_target_cluster_id": null,
      "rationale": "APM enablement uses an installed provider agent when that adapter is selected.",
      "source_capability_id": "capability:observability-agent-installation",
      "target_capability_id": "capability:apm-instrumentation-enablement"
    },
    {
      "evidence": [
        "curation/v2/fusion/decisions.jsonl",
        "gstack/land-and-deploy/SKILL.md:665-699",
        "deploy-to-vercel/SKILL.md:105-134"
      ],
      "id": "V2-DEPENDENCY-0195",
      "kind": "hard",
      "legacy_source_cluster_id": null,
      "legacy_target_cluster_id": null,
      "rationale": "Web deployment requires an explicitly prepared target environment.",
      "source_capability_id": "capability:deployment-environment-setup",
      "target_capability_id": "capability:web-hosting-deployment"
    },
    {
      "evidence": [
        "curation/v2/fusion/decisions.jsonl",
        "gstack/land-and-deploy/SKILL.md:665-699",
        "azure-kubernetes/SKILL.md:118-124"
      ],
      "id": "V2-DEPENDENCY-0196",
      "kind": "hard",
      "legacy_source_cluster_id": null,
      "legacy_target_cluster_id": null,
      "rationale": "Kubernetes deployment requires an explicitly prepared target environment.",
      "source_capability_id": "capability:deployment-environment-setup",
      "target_capability_id": "capability:kubernetes-application-deployment"
    },
    {
      "evidence": [
        "curation/v2/fusion/decisions.jsonl",
        "agent-observability-eval-pipeline/SKILL.md:317-356",
        "agent-observability-eval-pipeline/SKILL.md:381-420"
      ],
      "id": "V2-DEPENDENCY-0205",
      "kind": "hard",
      "legacy_source_cluster_id": null,
      "legacy_target_cluster_id": null,
      "rationale": "Dataset publication requires a frozen evaluator and quality contract.",
      "source_capability_id": "capability:llm-evaluator-engineering",
      "target_capability_id": "capability:evaluation-dataset-publication"
    },
    {
      "evidence": [
        "curation/v2/fusion/decisions.jsonl",
        "agent-observability-eval-pipeline/SKILL.md:381-420",
        "agent-observability-eval-pipeline/SKILL.md:467-504"
      ],
      "id": "V2-DEPENDENCY-0206",
      "kind": "optional",
      "legacy_source_cluster_id": null,
      "legacy_target_cluster_id": null,
      "rationale": "A provider experiment consumes the approved versioned dataset selected for that run.",
      "source_capability_id": "capability:evaluation-dataset-publication",
      "target_capability_id": "capability:llm-experiment-execution"
    },
    {
      "evidence": [
        "curation/v2/fusion/decisions.jsonl",
        "azure-kubernetes/azure-kubernetes-automatic-readiness/SKILL.md:10-49",
        "azure-kubernetes/SKILL.md:118-124"
      ],
      "id": "V2-DEPENDENCY-0210",
      "kind": "hard",
      "legacy_source_cluster_id": null,
      "legacy_target_cluster_id": null,
      "rationale": "A Kubernetes release must pass provider-specific readiness before deployment.",
      "source_capability_id": "capability:kubernetes-deployment-readiness",
      "target_capability_id": "capability:kubernetes-application-deployment"
    },
    {
      "evidence": [
        "curation/v2/fusion/decisions.jsonl",
        "gstack/ship/SKILL.md:706-745",
        "gstack/ship/SKILL.md:955-963"
      ],
      "id": "V2-DEPENDENCY-0238",
      "kind": "hard",
      "legacy_source_cluster_id": null,
      "legacy_target_cluster_id": null,
      "rationale": "Only a verified packaged ref may be pushed remotely.",
      "source_capability_id": "capability:change-packaging-and-versioning",
      "target_capability_id": "capability:remote-git-push"
    },
    {
      "evidence": [
        "curation/v2/fusion/decisions.jsonl",
        "gstack/ship/SKILL.md:955-963",
        "gstack/ship/sections/pr-body.md:180-225"
      ],
      "id": "V2-DEPENDENCY-0239",
      "kind": "optional",
      "legacy_source_cluster_id": null,
      "legacy_target_cluster_id": null,
      "rationale": "A pull request can be created or updated only after the intended ref exists remotely.",
      "source_capability_id": "capability:remote-git-push",
      "target_capability_id": "capability:remote-pull-request-change"
    },
    {
      "evidence": [
        "curation/v2/fusion/decisions.jsonl",
        "gstack/land-and-deploy/SKILL.md:535-574",
        "gstack/land-and-deploy/sections/merge-and-deploy.md:1-145"
      ],
      "id": "V2-DEPENDENCY-0240",
      "kind": "hard",
      "legacy_source_cluster_id": null,
      "legacy_target_cluster_id": null,
      "rationale": "Remote merge consumes a fresh passing readiness decision.",
      "source_capability_id": "capability:merge-and-deploy-readiness",
      "target_capability_id": "capability:remote-pull-request-merge"
    },
    {
      "evidence": [
        "curation/v2/fusion/decisions.jsonl",
        "gstack/land-and-deploy/sections/merge-and-deploy.md:1-145",
        "gstack/land-and-deploy/SKILL.md:796-810"
      ],
      "id": "V2-DEPENDENCY-0241",
      "kind": "optional",
      "legacy_source_cluster_id": null,
      "legacy_target_cluster_id": null,
      "rationale": "An explicit deploy trigger is selected only when merge does not already start the approved deployment.",
      "source_capability_id": "capability:remote-pull-request-merge",
      "target_capability_id": "capability:deployment-trigger-execution"
    },
    {
      "evidence": [
        "curation/v2/fusion/decisions.jsonl",
        "code-review/SKILL.md:11-11",
        "gstack/review/greptile-triage.md:97-111"
      ],
      "id": "V2-DEPENDENCY-0245",
      "kind": "optional",
      "legacy_source_cluster_id": null,
      "legacy_target_cluster_id": null,
      "rationale": "A verified review finding may produce one separately authorized provider response.",
      "source_capability_id": "capability:independent-code-review",
      "target_capability_id": "capability:pull-request-comment-response"
    },
    {
      "evidence": [
        "curation/v2/fusion/decisions.jsonl",
        "gstack/ship/SKILL.md:965-965",
        "gstack/ship/SKILL.md:955-963"
      ],
      "id": "V2-DEPENDENCY-0249",
      "kind": "optional",
      "legacy_source_cluster_id": null,
      "legacy_target_cluster_id": null,
      "rationale": "An approved local guard can protect a later push but never authorizes it.",
      "source_capability_id": "capability:local-git-guard-setup",
      "target_capability_id": "capability:remote-git-push"
    }
  ],
  "description": "Execute explicitly authorized remote deployment or configuration change.",
  "execution_state": "not-run-phase-9",
  "exit_contract": "one durable remote receipt or fail-closed action result; no cascaded authorization",
  "failure_policy": {
    "fail_closed": true,
    "invalidate_on": [
      "source artifact hash changes",
      "source decision or authority changes",
      "source capability re-runs",
      "source evidence becomes stale or fails verification"
    ],
    "never_execute_adjacent_step_implicitly": true,
    "stop_on": [
      "needs-input",
      "blocked",
      "failed"
    ]
  },
  "gates": [
    "select only atomic steps whose trigger matches and prerequisites are current",
    "hard dependencies are current-run prerequisites; optional dependencies never force activation; feedback dependencies feed a future pass and never block current-run execution",
    "no passed handoff without complete four-part evidence contract"
  ],
  "human_checkpoint": "human grants fresh per-action authorization for one exact target and immutable input",
  "id": "stage-11-deployment-change",
  "mandatory_stage": true,
  "schema_version": "2.0",
  "stage_id": "stage:11-deployment-change",
  "stage_order": 11,
  "status": "evaluating",
  "steps": [
    {
      "activation": "disabled-pending-current-authorization",
      "candidate_path": "evals/candidates/capability-compiler-v2/phase-7/skills/ai-observability-configuration",
      "condition": "Select only when the atomic requested outcome matches: Configure one provider's AI or LLM observability for exact applications and environments under explicit telemetry governance and per-action authorization.",
      "contract_sha256": "34bcabe6ac2dbe36f1aab63af9035fba3116c8a36404d66aa214abc32806466e",
      "default_state": "skipped",
      "dependency_refs": [
        "V2-DEPENDENCY-0180"
      ],
      "evidence_contract": [
        "artifact identities and hashes",
        "decision and authority record",
        "completion evidence",
        "known gaps and residual risk"
      ],
      "failure_routes": {
        "blocked": "stop-and-preserve-evidence",
        "failed": "stop-invalidate-dependents-and-record",
        "needs-input": "stop-and-request-owner-input",
        "passed": "emit-artifact-contract"
      },
      "hard_gates": [